00:00.0 Host bridge [0600]: Intel Corporation Mobile 945GM/PM/GMS, 943/940GML and 945GT Express Memory Controller Hub [8086:27a0] (rev 03)
	Subsystem: Lenovo ThinkPad T60/R60 series [17aa:2017]
	Control: I/O- Mem+ BusMaster+ SpecCycle- MemWINV- VGASnoop- ParErr- Stepping- SERR- FastB2B- DisINTx-
	Status: Cap+ 66MHz- UDF- FastB2B+ ParErr- DEVSEL=fast >TAbort- <TAbort- <MAbort+ >SERR- <PERR- INTx-
	Latency: 0
	Capabilities: [e0] Vendor Specific Information: Len=09 <?>
	Kernel driver in use: agpgart-intel
00: 86 80 a0 27 06 00 90 20 03 00 00 06 00 00 00 00
10: 00 00 00 00 00 00 00 00 00 00 00 00 00 00 00 00
20: 00 00 00 00 00 00 00 00 00 00 00 00 aa 17 17 20
30: 00 00 00 00 e0 00 00 00 00 00 00 00 00 00 00 00
40: 01 90 d1 fe 01 40 d1 fe 05 00 00 f0 01 80 d1 fe
50: 00 00 30 00 19 00 00 00 00 00 00 00 00 00 00 00
60: 01 30 d1 fe 00 00 00 00 00 00 00 00 00 00 00 00
70: 00 00 00 00 00 00 00 00 00 00 00 00 00 00 00 00
80: 00 00 00 00 00 00 00 00 00 00 00 00 00 00 00 00
90: 30 33 33 33 33 33 33 00 ff 03 00 00 80 1a 38 00
a0: 10 00 00 00 00 00 00 00 00 00 00 00 00 00 00 00
b0: 00 00 00 00 00 00 00 00 00 00 00 00 00 00 00 00
c0: 00 00 00 00 00 00 00 00 00 00 00 00 00 00 00 00
d0: 00 00 00 00 00 00 00 00 00 00 00 00 be ba fe ca
e0: 09 00 09 51 02 04 0a 90 0e 00 00 00 00 00 00 00
f0: 00 00 00 00 00 00 00 00 86 0f 05 00 10 00 00 00

00:02.0 VGA compatible controller [0300]: Intel Corporation Mobile 945GM/GMS, 943/940GML Express Integrated Graphics Controller [8086:27a2] (rev 03) (prog-if 00 [VGA controller])
	Subsystem: Lenovo ThinkPad T60/R60 series [17aa:201a]
	Control: I/O+ Mem+ BusMaster+ SpecCycle- MemWINV- VGASnoop- ParErr- Stepping- SERR- FastB2B- DisINTx-
	Status: Cap+ 66MHz- UDF- FastB2B+ ParErr- DEVSEL=fast >TAbort- <TAbort- <MAbort- >SERR- <PERR- INTx-
	Latency: 0
	Interrupt: pin A routed to IRQ 16
	Region 0: Memory at e4200000 (32-bit, non-prefetchable) [size=512K]
	Region 1: I/O ports at 50a0 [size=8]
	Region 2: Memory at d0000000 (32-bit, prefetchable) [size=256M]
	Region 3: Memory at e4300000 (32-bit, non-prefetchable) [size=256K]
	Expansion ROM at <unassigned> [disabled]
	Capabilities: [90] MSI: Enable- Count=1/1 Maskable- 64bit-
		Address: 00000000  Data: 0000
	Capabilities: [d0] Power Management version 2
		Flags: PMEClk- DSI+ D1- D2- AuxCurrent=0mA PME(D0-,D1-,D2-,D3hot-,D3cold-)
		Status: D0 NoSoftRst- PME-Enable- DSel=0 DScale=0 PME-
	Kernel driver in use: i915
00: 86 80 a2 27 07 00 90 00 03 00 00 03 00 00 80 00
10: 00 00 20 e4 a1 50 00 00 08 00 00 d0 00 00 30 e4
20: 00 00 00 00 00 00 00 00 00 00 00 00 aa 17 1a 20
30: 00 00 00 00 90 00 00 00 00 00 00 00 0b 01 00 00
40: 00 00 00 00 48 00 00 00 09 00 09 51 02 04 0a 90
50: 0e 00 30 00 19 00 00 00 00 00 00 00 00 00 80 7f
60: 00 00 02 00 00 00 00 00 00 00 00 00 00 00 00 00
70: 00 00 00 00 00 00 00 00 00 00 00 00 00 00 00 00
80: 00 00 00 00 00 00 00 00 00 00 00 00 00 00 00 00
90: 05 d0 00 00 00 00 00 00 00 00 00 00 00 00 00 00
a0: 00 00 00 00 00 00 00 00 00 00 00 00 00 00 00 00
b0: 00 00 00 00 00 00 00 00 00 00 00 00 00 00 00 00
c0: 00 04 00 00 00 00 00 00 00 00 00 00 00 00 00 00
d0: 01 00 22 00 00 00 00 00 00 00 00 00 00 00 00 00
e0: 00 00 00 00 00 00 00 00 00 00 00 00 00 00 00 00
f0: 03 00 64 34 ff 00 00 00 86 0f 05 00 00 00 00 00

00:02.1 Display controller [0380]: Intel Corporation Mobile 945GM/GMS/GME, 943/940GML Express Integrated Graphics Controller [8086:27a6] (rev 03)
	Subsystem: Lenovo ThinkPad T60/R60 series [17aa:201a]
	Control: I/O+ Mem+ BusMaster+ SpecCycle- MemWINV- VGASnoop- ParErr- Stepping- SERR- FastB2B- DisINTx-
	Status: Cap+ 66MHz- UDF- FastB2B+ ParErr- DEVSEL=fast >TAbort- <TAbort- <MAbort- >SERR- <PERR- INTx-
	Latency: 0
	Region 0: Memory at e4280000 (32-bit, non-prefetchable) [size=512K]
	Capabilities: [d0] Power Management version 2
		Flags: PMEClk- DSI+ D1- D2- AuxCurrent=0mA PME(D0-,D1-,D2-,D3hot-,D3cold-)
		Status: D0 NoSoftRst- PME-Enable- DSel=0 DScale=0 PME-
00: 86 80 a6 27 07 00 90 00 03 00 80 03 00 00 80 00
10: 00 00 28 e4 00 00 00 00 00 00 00 00 00 00 00 00
20: 00 00 00 00 00 00 00 00 00 00 00 00 aa 17 1a 20
30: 00 00 00 00 d0 00 00 00 00 00 00 00 00 00 00 00
40: 00 00 00 00 48 00 00 00 09 00 09 51 02 04 0a 90
50: 0e 00 30 00 19 00 00 00 00 00 00 00 00 00 80 7f
60: 00 00 02 00 00 00 00 00 00 00 00 00 00 00 00 00
70: 00 00 00 00 00 00 00 00 00 00 00 00 00 00 00 00
80: 00 00 00 00 00 00 00 00 00 00 00 00 00 00 00 00
90: 00 00 00 00 00 00 00 00 00 00 00 00 00 00 00 00
a0: 00 00 00 00 00 00 00 00 00 00 00 00 00 00 00 00
b0: 00 00 00 00 00 00 00 00 00 00 00 00 00 00 00 00
c0: 00 04 00 00 00 00 00 00 00 00 00 00 00 00 00 00
d0: 01 00 22 00 00 00 00 00 00 00 00 00 00 00 00 00
e0: 00 00 00 00 00 00 00 00 00 00 00 00 00 00 00 00
f0: 03 00 64 34 ff 00 00 00 86 0f 05 00 00 00 00 00

00:1b.0 Audio device [0403]: Intel Corporation NM10/ICH7 Family High Definition Audio Controller [8086:27d8] (rev 02)
	Subsystem: Lenovo ThinkPad T60/R60 series [17aa:2010]
	Control: I/O- Mem+ BusMaster+ SpecCycle- MemWINV- VGASnoop- ParErr- Stepping- SERR+ FastB2B- DisINTx+
	Status: Cap+ 66MHz- UDF- FastB2B- ParErr- DEVSEL=fast >TAbort- <TAbort- <MAbort- >SERR- <PERR- INTx-
	Latency: 0, Cache Line Size: 64 bytes
	Interrupt: pin B routed to IRQ 46
	Region 0: Memory at e4340000 (64-bit, non-prefetchable) [size=16K]
	Capabilities: [50] Power Management version 2
		Flags: PMEClk- DSI- D1- D2- AuxCurrent=55mA PME(D0+,D1-,D2-,D3hot+,D3cold+)
		Status: D0 NoSoftRst- PME-Enable- DSel=0 DScale=0 PME-
	Capabilities: [60] MSI: Enable+ Count=1/1 Maskable- 64bit+
		Address: 00000000fee0300c  Data: 4162
	Capabilities: [70] Express (v1) Root Complex Integrated Endpoint, MSI 00
		DevCap:	MaxPayload 128 bytes, PhantFunc 0, Latency L0s <64ns, L1 <1us
			ExtTag- RBE- FLReset-
		DevCtl:	Report errors: Correctable- Non-Fatal- Fatal- Unsupported-
			RlxdOrd- ExtTag- PhantFunc- AuxPwr- NoSnoop+
			MaxPayload 128 bytes, MaxReadReq 128 bytes
		DevSta:	CorrErr- UncorrErr- FatalErr- UnsuppReq- AuxPwr+ TransPend-
		LnkCap:	Port #0, Speed unknown, Width x0, ASPM unknown, Latency L0 <64ns, L1 <1us
			ClockPM- Surprise- LLActRep- BwNot-
		LnkCtl:	ASPM Disabled; Disabled- Retrain- CommClk-
			ExtSynch- ClockPM- AutWidDis- BWInt- AutBWInt-
		LnkSta:	Speed unknown, Width x0, TrErr- Train- SlotClk- DLActive- BWMgmt- ABWMgmt-
	Capabilities: [100 v1] Virtual Channel
		Caps:	LPEVC=0 RefClk=100ns PATEntryBits=1
		Arb:	Fixed- WRR32- WRR64- WRR128-
		Ctrl:	ArbSelect=Fixed
		Status:	InProgress-
		VC0:	Caps:	PATOffset=00 MaxTimeSlots=1 RejSnoopTrans-
			Arb:	Fixed- WRR32- WRR64- WRR128- TWRR128- WRR256-
			Ctrl:	Enable+ ID=0 ArbSelect=Fixed TC/VC=01
			Status:	NegoPending- InProgress-
		VC1:	Caps:	PATOffset=00 MaxTimeSlots=1 RejSnoopTrans-
			Arb:	Fixed- WRR32- WRR64- WRR128- TWRR128- WRR256-
			Ctrl:	Enable+ ID=1 ArbSelect=Fixed TC/VC=80
			Status:	NegoPending- InProgress-
	Capabilities: [130 v1] Root Complex Link
		Desc:	PortNumber=0f ComponentID=00 EltType=Config
		Link0:	Desc:	TargetPort=00 TargetComponent=00 AssocRCRB- LinkType=MemMapped LinkValid+
			Addr:	00000000fed1c000
	Kernel driver in use: snd_hda_intel
00: 86 80 d8 27 06 05 10 00 02 00 03 04 10 00 00 00
10: 04 00 34 e4 00 00 00 00 00 00 00 00 00 00 00 00
20: 00 00 00 00 00 00 00 00 00 00 00 00 aa 17 10 20
30: 00 00 00 00 50 00 00 00 00 00 00 00 0b 02 00 00
40: 07 00 00 03 00 00 00 00 00 00 00 00 00 00 00 00
50: 01 60 42 c8 00 00 00 00 00 00 00 00 00 00 00 00
60: 05 70 81 00 0c 30 e0 fe 00 00 00 00 62 41 00 00
70: 10 00 91 00 00 00 00 00 00 08 10 00 00 00 00 00
80: 00 00 00 00 00 00 00 00 00 00 00 00 00 00 00 00
90: 00 00 00 00 00 00 00 00 00 00 00 00 00 00 00 00
a0: 00 00 00 00 00 00 00 00 00 00 00 00 00 00 00 00
b0: 00 00 00 00 00 00 00 00 00 00 00 00 00 00 00 00
c0: 00 00 00 01 00 00 00 00 00 00 00 00 00 00 00 00
d0: 00 00 00 00 00 00 00 00 00 00 00 00 00 00 00 00
e0: 00 00 00 00 00 00 00 00 00 00 00 00 00 00 00 00
f0: 00 00 00 00 00 00 00 00 86 0f 02 00 00 00 00 00

00:1c.0 PCI bridge [0604]: Intel Corporation NM10/ICH7 Family PCI Express Port 1 [8086:27d0] (rev 02) (prog-if 00 [Normal decode])
	Control: I/O+ Mem+ BusMaster+ SpecCycle- MemWINV- VGASnoop- ParErr- Stepping- SERR+ FastB2B- DisINTx+
	Status: Cap+ 66MHz- UDF- FastB2B- ParErr- DEVSEL=fast >TAbort- <TAbort- <MAbort- >SERR- <PERR- INTx-
	Latency: 0, Cache Line Size: 64 bytes
	Bus: primary=00, secondary=01, subordinate=01, sec-latency=0
	I/O behind bridge: 00004000-00004fff
	Memory behind bridge: e4100000-e41fffff
	Prefetchable memory behind bridge: 0000000080000000-00000000801fffff
	Secondary status: 66MHz- FastB2B- ParErr- DEVSEL=fast >TAbort- <TAbort- <MAbort- <SERR- <PERR-
	BridgeCtl: Parity- SERR+ NoISA+ VGA- MAbort- >Reset- FastB2B-
		PriDiscTmr- SecDiscTmr- DiscTmrStat- DiscTmrSERREn-
	Capabilities: [40] Express (v1) Root Port (Slot+), MSI 00
		DevCap:	MaxPayload 128 bytes, PhantFunc 0, Latency L0s unlimited, L1 unlimited
			ExtTag- RBE- FLReset-
		DevCtl:	Report errors: Correctable- Non-Fatal- Fatal- Unsupported-
			RlxdOrd- ExtTag- PhantFunc- AuxPwr- NoSnoop-
			MaxPayload 128 bytes, MaxReadReq 128 bytes
		DevSta:	CorrErr- UncorrErr- FatalErr- UnsuppReq- AuxPwr+ TransPend-
		LnkCap:	Port #1, Speed 2.5GT/s, Width x1, ASPM L0s L1, Latency L0 <256ns, L1 <4us
			ClockPM- Surprise- LLActRep+ BwNot-
		LnkCtl:	ASPM Disabled; RCB 64 bytes Disabled- Retrain- CommClk+
			ExtSynch- ClockPM- AutWidDis- BWInt- AutBWInt-
		LnkSta:	Speed 2.5GT/s, Width x1, TrErr- Train- SlotClk+ DLActive+ BWMgmt- ABWMgmt-
		SltCap:	AttnBtn- PwrCtrl- MRL- AttnInd- PwrInd- HotPlug+ Surprise+
			Slot #0, PowerLimit 0.000W; Interlock- NoCompl-
		SltCtl:	Enable: AttnBtn- PwrFlt- MRL- PresDet+ CmdCplt+ HPIrq+ LinkChg+
			Control: AttnInd Unknown, PwrInd Unknown, Power- Interlock-
		SltSta:	Status: AttnBtn- PowerFlt- MRL- CmdCplt- PresDet+ Interlock-
			Changed: MRL- PresDet- LinkState+
		RootCtl: ErrCorrectable- ErrNon-Fatal- ErrFatal- PMEIntEna+ CRSVisible-
		RootCap: CRSVisible-
		RootSta: PME ReqID 0000, PMEStatus- PMEPending-
	Capabilities: [80] MSI: Enable+ Count=1/1 Maskable- 64bit-
		Address: fee0300c  Data: 4191
	Capabilities: [90] Subsystem: Intel Corporation NM10/ICH7 Family PCI Express Port 1 [8086:27d0]
	Capabilities: [a0] Power Management version 2
		Flags: PMEClk- DSI- D1- D2- AuxCurrent=0mA PME(D0+,D1-,D2-,D3hot+,D3cold+)
		Status: D0 NoSoftRst- PME-Enable- DSel=0 DScale=0 PME-
	Capabilities: [100 v1] Virtual Channel
		Caps:	LPEVC=0 RefClk=100ns PATEntryBits=1
		Arb:	Fixed+ WRR32- WRR64- WRR128-
		Ctrl:	ArbSelect=Fixed
		Status:	InProgress-
		VC0:	Caps:	PATOffset=00 MaxTimeSlots=1 RejSnoopTrans-
			Arb:	Fixed+ WRR32- WRR64- WRR128- TWRR128- WRR256-
			Ctrl:	Enable+ ID=0 ArbSelect=Fixed TC/VC=01
			Status:	NegoPending- InProgress-
		VC1:	Caps:	PATOffset=00 MaxTimeSlots=1 RejSnoopTrans-
			Arb:	Fixed+ WRR32- WRR64- WRR128- TWRR128- WRR256-
			Ctrl:	Enable- ID=0 ArbSelect=Fixed TC/VC=00
			Status:	NegoPending- InProgress-
	Capabilities: [180 v1] Root Complex Link
		Desc:	PortNumber=01 ComponentID=00 EltType=Config
		Link0:	Desc:	TargetPort=00 TargetComponent=00 AssocRCRB- LinkType=MemMapped LinkValid+
			Addr:	00000000fed1c001
	Kernel driver in use: pcieport
00: 86 80 d0 27 07 05 10 00 02 00 04 06 10 00 81 00
10: 00 00 00 00 00 00 00 00 00 01 01 00 40 40 00 00
20: 10 e4 10 e4 01 80 11 80 00 00 00 00 00 00 00 00
30: 00 00 00 00 40 00 00 00 00 00 00 00 0b 01 06 00
40: 10 80 41 01 c0 0f 00 00 00 00 10 00 11 2c 11 01
50: 40 00 11 30 60 00 00 00 38 10 40 01 08 00 00 00
60: 00 00 00 00 00 00 00 00 00 00 00 00 00 00 00 00
70: 00 00 00 00 00 00 00 00 00 00 00 00 00 00 00 00
80: 05 90 01 00 0c 30 e0 fe 91 41 00 00 00 00 00 00
90: 0d a0 00 00 86 80 d0 27 00 00 00 00 00 00 00 00
a0: 01 00 02 c8 00 00 00 00 00 00 00 00 00 00 00 00
b0: 00 00 00 00 00 00 00 00 00 00 00 00 00 00 00 00
c0: 00 00 00 00 00 00 00 00 00 00 00 00 00 00 00 00
d0: 00 00 00 00 00 00 00 00 80 00 11 00 00 00 00 00
e0: 0e 00 c7 00 06 07 08 00 00 00 00 00 00 00 00 00
f0: 00 00 00 00 00 00 00 00 86 0f 02 00 00 00 00 00

00:1c.1 PCI bridge [0604]: Intel Corporation NM10/ICH7 Family PCI Express Port 2 [8086:27d2] (rev 02) (prog-if 00 [Normal decode])
	Control: I/O- Mem- BusMaster+ SpecCycle- MemWINV- VGASnoop- ParErr- Stepping- SERR+ FastB2B- DisINTx+
	Status: Cap+ 66MHz- UDF- FastB2B- ParErr- DEVSEL=fast >TAbort- <TAbort- <MAbort- >SERR- <PERR- INTx-
	Latency: 0, Cache Line Size: 64 bytes
	Bus: primary=00, secondary=02, subordinate=02, sec-latency=0
	Secondary status: 66MHz- FastB2B- ParErr- DEVSEL=fast >TAbort- <TAbort- <MAbort+ <SERR- <PERR-
	BridgeCtl: Parity- SERR+ NoISA+ VGA- MAbort- >Reset- FastB2B-
		PriDiscTmr- SecDiscTmr- DiscTmrStat- DiscTmrSERREn-
	Capabilities: [40] Express (v1) Root Port (Slot-), MSI 00
		DevCap:	MaxPayload 128 bytes, PhantFunc 0, Latency L0s unlimited, L1 unlimited
			ExtTag- RBE- FLReset-
		DevCtl:	Report errors: Correctable- Non-Fatal- Fatal- Unsupported-
			RlxdOrd- ExtTag- PhantFunc- AuxPwr- NoSnoop-
			MaxPayload 128 bytes, MaxReadReq 128 bytes
		DevSta:	CorrErr- UncorrErr- FatalErr- UnsuppReq- AuxPwr+ TransPend-
		LnkCap:	Port #2, Speed 2.5GT/s, Width x1, ASPM L0s L1, Latency L0 <256ns, L1 <4us
			ClockPM- Surprise- LLActRep+ BwNot-
		LnkCtl:	ASPM Disabled; RCB 64 bytes Disabled- Retrain- CommClk+
			ExtSynch- ClockPM- AutWidDis- BWInt- AutBWInt-
		LnkSta:	Speed 2.5GT/s, Width x0, TrErr- Train- SlotClk+ DLActive- BWMgmt- ABWMgmt-
		RootCtl: ErrCorrectable- ErrNon-Fatal- ErrFatal- PMEIntEna+ CRSVisible-
		RootCap: CRSVisible-
		RootSta: PME ReqID 0000, PMEStatus- PMEPending-
	Capabilities: [80] MSI: Enable+ Count=1/1 Maskable- 64bit-
		Address: fee0300c  Data: 41b1
	Capabilities: [90] Subsystem: Intel Corporation NM10/ICH7 Family PCI Express Port 2 [8086:27d2]
	Capabilities: [a0] Power Management version 2
		Flags: PMEClk- DSI- D1- D2- AuxCurrent=0mA PME(D0+,D1-,D2-,D3hot+,D3cold+)
		Status: D0 NoSoftRst- PME-Enable- DSel=0 DScale=0 PME-
	Capabilities: [100 v1] Virtual Channel
		Caps:	LPEVC=0 RefClk=100ns PATEntryBits=1
		Arb:	Fixed+ WRR32- WRR64- WRR128-
		Ctrl:	ArbSelect=Fixed
		Status:	InProgress-
		VC0:	Caps:	PATOffset=00 MaxTimeSlots=1 RejSnoopTrans-
			Arb:	Fixed+ WRR32- WRR64- WRR128- TWRR128- WRR256-
			Ctrl:	Enable+ ID=0 ArbSelect=Fixed TC/VC=01
			Status:	NegoPending- InProgress-
		VC1:	Caps:	PATOffset=00 MaxTimeSlots=1 RejSnoopTrans-
			Arb:	Fixed+ WRR32- WRR64- WRR128- TWRR128- WRR256-
			Ctrl:	Enable- ID=0 ArbSelect=Fixed TC/VC=00
			Status:	NegoPending- InProgress-
	Capabilities: [180 v1] Root Complex Link
		Desc:	PortNumber=02 ComponentID=00 EltType=Config
		Link0:	Desc:	TargetPort=00 TargetComponent=00 AssocRCRB- LinkType=MemMapped LinkValid+
			Addr:	00000000fed1c001
	Kernel driver in use: pcieport
00: 86 80 d2 27 04 05 10 00 02 00 04 06 10 00 81 00
10: 00 00 00 00 00 00 00 00 00 02 02 00 f0 00 00 20
20: f0 ff 00 00 f1 ff 01 00 00 00 00 00 00 00 00 00
30: 00 00 00 00 40 00 00 00 00 00 00 00 0b 02 06 00
40: 10 80 41 00 c0 0f 00 00 00 00 10 00 11 2c 11 02
50: 40 00 01 10 60 00 00 00 00 00 40 00 08 00 00 00
60: 00 00 00 00 00 00 00 00 00 00 00 00 00 00 00 00
70: 00 00 00 00 00 00 00 00 00 00 00 00 00 00 00 00
80: 05 90 01 00 0c 30 e0 fe b1 41 00 00 00 00 00 00
90: 0d a0 00 00 86 80 d2 27 00 00 00 00 00 00 00 00
a0: 01 00 02 c8 00 00 00 00 00 00 00 00 00 00 00 00
b0: 00 00 00 00 00 00 00 00 00 00 00 00 00 00 00 00
c0: 00 00 00 00 00 00 00 00 00 00 00 00 00 00 00 00
d0: 00 00 00 00 00 00 00 00 80 00 11 00 00 00 00 00
e0: 0e 00 c7 00 06 07 08 00 00 00 00 00 00 00 00 00
f0: 00 00 00 00 00 00 00 00 86 0f 02 00 00 00 00 00

00:1c.2 PCI bridge [0604]: Intel Corporation NM10/ICH7 Family PCI Express Port 3 [8086:27d4] (rev 02) (prog-if 00 [Normal decode])
	Control: I/O- Mem- BusMaster+ SpecCycle- MemWINV- VGASnoop- ParErr- Stepping- SERR- FastB2B- DisINTx+
	Status: Cap+ 66MHz- UDF- FastB2B- ParErr- DEVSEL=fast >TAbort- <TAbort- <MAbort- >SERR- <PERR- INTx-
	Latency: 0, Cache Line Size: 64 bytes
	Bus: primary=00, secondary=03, subordinate=03, sec-latency=0
	Secondary status: 66MHz- FastB2B- ParErr- DEVSEL=fast >TAbort- <TAbort- <MAbort+ <SERR- <PERR-
	BridgeCtl: Parity- SERR+ NoISA+ VGA- MAbort- >Reset- FastB2B-
		PriDiscTmr- SecDiscTmr- DiscTmrStat- DiscTmrSERREn-
	Capabilities: [40] Express (v1) Root Port (Slot-), MSI 00
		DevCap:	MaxPayload 128 bytes, PhantFunc 0, Latency L0s unlimited, L1 unlimited
			ExtTag- RBE- FLReset-
		DevCtl:	Report errors: Correctable- Non-Fatal- Fatal- Unsupported-
			RlxdOrd- ExtTag- PhantFunc- AuxPwr- NoSnoop-
			MaxPayload 128 bytes, MaxReadReq 128 bytes
		DevSta:	CorrErr- UncorrErr- FatalErr- UnsuppReq- AuxPwr+ TransPend-
		LnkCap:	Port #3, Speed 2.5GT/s, Width x1, ASPM L0s L1, Latency L0 <256ns, L1 <4us
			ClockPM- Surprise- LLActRep+ BwNot-
		LnkCtl:	ASPM Disabled; RCB 64 bytes Disabled- Retrain- CommClk+
			ExtSynch- ClockPM- AutWidDis- BWInt- AutBWInt-
		LnkSta:	Speed 2.5GT/s, Width x0, TrErr- Train- SlotClk+ DLActive- BWMgmt- ABWMgmt-
		RootCtl: ErrCorrectable- ErrNon-Fatal- ErrFatal- PMEIntEna+ CRSVisible-
		RootCap: CRSVisible-
		RootSta: PME ReqID 0000, PMEStatus- PMEPending-
	Capabilities: [80] MSI: Enable+ Count=1/1 Maskable- 64bit-
		Address: fee0300c  Data: 41d1
	Capabilities: [90] Subsystem: Device [0000:0000]
	Capabilities: [a0] Power Management version 2
		Flags: PMEClk- DSI- D1- D2- AuxCurrent=0mA PME(D0+,D1-,D2-,D3hot+,D3cold+)
		Status: D0 NoSoftRst- PME-Enable- DSel=0 DScale=0 PME-
	Capabilities: [100 v1] Virtual Channel
		Caps:	LPEVC=0 RefClk=100ns PATEntryBits=1
		Arb:	Fixed+ WRR32- WRR64- WRR128-
		Ctrl:	ArbSelect=Fixed
		Status:	InProgress-
		VC0:	Caps:	PATOffset=00 MaxTimeSlots=1 RejSnoopTrans-
			Arb:	Fixed+ WRR32- WRR64- WRR128- TWRR128- WRR256-
			Ctrl:	Enable+ ID=0 ArbSelect=Fixed TC/VC=01
			Status:	NegoPending- InProgress-
		VC1:	Caps:	PATOffset=00 MaxTimeSlots=1 RejSnoopTrans-
			Arb:	Fixed+ WRR32- WRR64- WRR128- TWRR128- WRR256-
			Ctrl:	Enable- ID=0 ArbSelect=Fixed TC/VC=00
			Status:	NegoPending- InProgress-
	Capabilities: [180 v1] Root Complex Link
		Desc:	PortNumber=03 ComponentID=00 EltType=Config
		Link0:	Desc:	TargetPort=00 TargetComponent=00 AssocRCRB- LinkType=MemMapped LinkValid+
			Addr:	00000000fed1c001
	Kernel driver in use: pcieport
00: 86 80 d4 27 04 04 10 00 02 00 04 06 10 00 81 00
10: 00 00 00 00 00 00 00 00 00 03 03 00 f0 00 00 20
20: f0 ff 00 00 f1 ff 01 00 00 00 00 00 00 00 00 00
30: 00 00 00 00 40 00 00 00 00 00 00 00 0b 03 06 00
40: 10 80 41 00 c0 0f 00 00 00 00 10 00 11 2c 11 03
50: 40 00 01 10 60 00 00 00 00 00 40 00 08 00 00 00
60: 00 00 00 00 00 00 00 00 00 00 00 00 00 00 00 00
70: 00 00 00 00 00 00 00 00 00 00 00 00 00 00 00 00
80: 05 90 01 00 0c 30 e0 fe d1 41 00 00 00 00 00 00
90: 0d a0 00 00 00 00 00 00 00 00 00 00 00 00 00 00
a0: 01 00 02 c8 00 00 00 00 00 00 00 00 00 00 00 00
b0: 00 00 00 00 00 00 00 00 00 00 00 00 00 00 00 00
c0: 00 00 00 00 00 00 00 00 00 00 00 00 00 00 00 00
d0: 00 00 00 00 00 00 00 00 80 00 11 00 00 00 00 00
e0: 0e 00 c7 00 06 07 08 00 00 00 00 00 00 00 00 00
f0: 00 00 00 00 00 00 00 00 86 0f 02 00 00 00 00 00

00:1c.3 PCI bridge [0604]: Intel Corporation NM10/ICH7 Family PCI Express Port 4 [8086:27d6] (rev 02) (prog-if 00 [Normal decode])
	Control: I/O- Mem- BusMaster+ SpecCycle- MemWINV- VGASnoop- ParErr- Stepping- SERR- FastB2B- DisINTx+
	Status: Cap+ 66MHz- UDF- FastB2B- ParErr- DEVSEL=fast >TAbort- <TAbort- <MAbort- >SERR- <PERR- INTx-
	Latency: 0, Cache Line Size: 64 bytes
	Bus: primary=00, secondary=04, subordinate=04, sec-latency=0
	Secondary status: 66MHz- FastB2B- ParErr- DEVSEL=fast >TAbort- <TAbort- <MAbort+ <SERR- <PERR-
	BridgeCtl: Parity- SERR+ NoISA+ VGA- MAbort- >Reset- FastB2B-
		PriDiscTmr- SecDiscTmr- DiscTmrStat- DiscTmrSERREn-
	Capabilities: [40] Express (v1) Root Port (Slot-), MSI 00
		DevCap:	MaxPayload 128 bytes, PhantFunc 0, Latency L0s unlimited, L1 unlimited
			ExtTag- RBE- FLReset-
		DevCtl:	Report errors: Correctable- Non-Fatal- Fatal- Unsupported-
			RlxdOrd- ExtTag- PhantFunc- AuxPwr- NoSnoop-
			MaxPayload 128 bytes, MaxReadReq 128 bytes
		DevSta:	CorrErr- UncorrErr- FatalErr- UnsuppReq- AuxPwr+ TransPend-
		LnkCap:	Port #4, Speed 2.5GT/s, Width x1, ASPM L0s L1, Latency L0 <256ns, L1 <4us
			ClockPM- Surprise- LLActRep+ BwNot-
		LnkCtl:	ASPM Disabled; RCB 64 bytes Disabled- Retrain- CommClk+
			ExtSynch- ClockPM- AutWidDis- BWInt- AutBWInt-
		LnkSta:	Speed 2.5GT/s, Width x0, TrErr- Train- SlotClk+ DLActive- BWMgmt- ABWMgmt-
		RootCtl: ErrCorrectable- ErrNon-Fatal- ErrFatal- PMEIntEna+ CRSVisible-
		RootCap: CRSVisible-
		RootSta: PME ReqID 0000, PMEStatus- PMEPending-
	Capabilities: [80] MSI: Enable+ Count=1/1 Maskable- 64bit-
		Address: fee0300c  Data: 4122
	Capabilities: [90] Subsystem: Device [0000:0000]
	Capabilities: [a0] Power Management version 2
		Flags: PMEClk- DSI- D1- D2- AuxCurrent=0mA PME(D0+,D1-,D2-,D3hot+,D3cold+)
		Status: D0 NoSoftRst- PME-Enable- DSel=0 DScale=0 PME-
	Capabilities: [100 v1] Virtual Channel
		Caps:	LPEVC=0 RefClk=100ns PATEntryBits=1
		Arb:	Fixed+ WRR32- WRR64- WRR128-
		Ctrl:	ArbSelect=Fixed
		Status:	InProgress-
		VC0:	Caps:	PATOffset=00 MaxTimeSlots=1 RejSnoopTrans-
			Arb:	Fixed+ WRR32- WRR64- WRR128- TWRR128- WRR256-
			Ctrl:	Enable+ ID=0 ArbSelect=Fixed TC/VC=01
			Status:	NegoPending- InProgress-
		VC1:	Caps:	PATOffset=00 MaxTimeSlots=1 RejSnoopTrans-
			Arb:	Fixed+ WRR32- WRR64- WRR128- TWRR128- WRR256-
			Ctrl:	Enable- ID=0 ArbSelect=Fixed TC/VC=00
			Status:	NegoPending- InProgress-
	Capabilities: [180 v1] Root Complex Link
		Desc:	PortNumber=04 ComponentID=00 EltType=Config
		Link0:	Desc:	TargetPort=00 TargetComponent=00 AssocRCRB- LinkType=MemMapped LinkValid+
			Addr:	00000000fed1c001
	Kernel driver in use: pcieport
00: 86 80 d6 27 04 04 10 00 02 00 04 06 10 00 81 00
10: 00 00 00 00 00 00 00 00 00 04 04 00 f0 00 00 20
20: f0 ff 00 00 f1 ff 01 00 00 00 00 00 00 00 00 00
30: 00 00 00 00 40 00 00 00 00 00 00 00 0b 04 06 00
40: 10 80 41 00 c0 0f 00 00 00 00 10 00 11 2c 11 04
50: 40 00 01 10 60 00 00 00 00 00 40 00 08 00 00 00
60: 00 00 00 00 00 00 00 00 00 00 00 00 00 00 00 00
70: 00 00 00 00 00 00 00 00 00 00 00 00 00 00 00 00
80: 05 90 01 00 0c 30 e0 fe 22 41 00 00 00 00 00 00
90: 0d a0 00 00 00 00 00 00 00 00 00 00 00 00 00 00
a0: 01 00 02 c8 00 00 00 00 00 00 00 00 00 00 00 00
b0: 00 00 00 00 00 00 00 00 00 00 00 00 00 00 00 00
c0: 00 00 00 00 00 00 00 00 00 00 00 00 00 00 00 00
d0: 00 00 00 00 00 00 00 00 80 00 11 00 00 00 00 00
e0: 0e 00 c7 00 06 07 08 00 00 00 00 00 00 00 00 00
f0: 00 00 00 00 00 00 00 00 86 0f 02 00 00 00 00 00

00:1d.0 USB controller [0c03]: Intel Corporation NM10/ICH7 Family USB UHCI Controller #1 [8086:27c8] (rev 02) (prog-if 00 [UHCI])
	Subsystem: Lenovo ThinkPad T60/R60 series [17aa:200a]
	Control: I/O+ Mem- BusMaster- SpecCycle- MemWINV- VGASnoop- ParErr- Stepping- SERR- FastB2B- DisINTx-
	Status: Cap- 66MHz- UDF- FastB2B+ ParErr- DEVSEL=medium >TAbort- <TAbort- <MAbort- >SERR- <PERR- INTx-
	Interrupt: pin A routed to IRQ 16
	Region 4: I/O ports at 5000 [size=32]
	Kernel driver in use: uhci_hcd
00: 86 80 c8 27 01 00 80 02 02 00 03 0c 00 00 80 00
10: 00 00 00 00 00 00 00 00 00 00 00 00 00 00 00 00
20: 01 50 00 00 00 00 00 00 00 00 00 00 aa 17 0a 20
30: 00 00 00 00 00 00 00 00 00 00 00 00 0b 01 00 00
40: 00 00 00 00 00 00 00 00 00 00 00 00 00 00 00 00
50: 00 00 00 00 00 00 00 00 00 00 00 00 00 00 00 00
60: 10 00 00 00 00 00 00 00 00 00 00 00 00 00 00 00
70: 00 00 00 00 00 00 00 00 00 00 00 00 00 00 00 00
80: 00 00 00 00 00 00 00 00 00 00 00 00 00 00 00 00
90: 00 00 00 00 00 00 00 00 00 00 00 00 00 00 00 00
a0: 00 00 00 00 00 00 00 00 00 00 00 00 00 00 00 00
b0: 00 00 00 00 00 00 00 00 00 00 00 00 00 00 00 00
c0: 00 0f 00 00 03 00 00 00 00 00 01 00 00 00 00 00
d0: 00 00 00 00 00 00 00 00 00 00 00 00 00 00 00 00
e0: 00 00 00 00 00 00 00 00 00 00 00 00 00 00 00 00
f0: 00 00 00 00 00 00 00 00 86 0f 02 00 00 00 00 00

00:1d.1 USB controller [0c03]: Intel Corporation NM10/ICH7 Family USB UHCI Controller #2 [8086:27c9] (rev 02) (prog-if 00 [UHCI])
	Subsystem: Lenovo ThinkPad T60/R60 series [17aa:200a]
	Control: I/O+ Mem- BusMaster- SpecCycle- MemWINV- VGASnoop- ParErr- Stepping- SERR- FastB2B- DisINTx-
	Status: Cap- 66MHz- UDF- FastB2B+ ParErr- DEVSEL=medium >TAbort- <TAbort- <MAbort- >SERR- <PERR- INTx-
	Interrupt: pin B routed to IRQ 17
	Region 4: I/O ports at 5020 [size=32]
	Kernel driver in use: uhci_hcd
00: 86 80 c9 27 01 00 80 02 02 00 03 0c 00 00 00 00
10: 00 00 00 00 00 00 00 00 00 00 00 00 00 00 00 00
20: 21 50 00 00 00 00 00 00 00 00 00 00 aa 17 0a 20
30: 00 00 00 00 00 00 00 00 00 00 00 00 0b 02 00 00
40: 00 00 00 00 00 00 00 00 00 00 00 00 00 00 00 00
50: 00 00 00 00 00 00 00 00 00 00 00 00 00 00 00 00
60: 10 00 00 00 00 00 00 00 00 00 00 00 00 00 00 00
70: 00 00 00 00 00 00 00 00 00 00 00 00 00 00 00 00
80: 00 00 00 00 00 00 00 00 00 00 00 00 00 00 00 00
90: 00 00 00 00 00 00 00 00 00 00 00 00 00 00 00 00
a0: 00 00 00 00 00 00 00 00 00 00 00 00 00 00 00 00
b0: 00 00 00 00 00 00 00 00 00 00 00 00 00 00 00 00
c0: 00 0f 00 00 03 00 00 00 00 00 01 00 00 00 00 00
d0: 00 00 00 00 00 00 00 00 00 00 00 00 00 00 00 00
e0: 00 00 00 00 00 00 00 00 00 00 00 00 00 00 00 00
f0: 00 00 00 00 00 00 00 00 86 0f 02 00 00 00 00 00

00:1d.2 USB controller [0c03]: Intel Corporation NM10/ICH7 Family USB UHCI Controller #3 [8086:27ca] (rev 02) (prog-if 00 [UHCI])
	Subsystem: Lenovo ThinkPad T60/R60 series [17aa:200a]
	Control: I/O+ Mem- BusMaster- SpecCycle- MemWINV- VGASnoop- ParErr- Stepping- SERR- FastB2B- DisINTx-
	Status: Cap- 66MHz- UDF- FastB2B+ ParErr- DEVSEL=medium >TAbort- <TAbort- <MAbort- >SERR- <PERR- INTx-
	Interrupt: pin C routed to IRQ 18
	Region 4: I/O ports at 5040 [size=32]
	Kernel driver in use: uhci_hcd
00: 86 80 ca 27 01 00 80 02 02 00 03 0c 00 00 00 00
10: 00 00 00 00 00 00 00 00 00 00 00 00 00 00 00 00
20: 41 50 00 00 00 00 00 00 00 00 00 00 aa 17 0a 20
30: 00 00 00 00 00 00 00 00 00 00 00 00 0b 03 00 00
40: 00 00 00 00 00 00 00 00 00 00 00 00 00 00 00 00
50: 00 00 00 00 00 00 00 00 00 00 00 00 00 00 00 00
60: 10 00 00 00 00 00 00 00 00 00 00 00 00 00 00 00
70: 00 00 00 00 00 00 00 00 00 00 00 00 00 00 00 00
80: 00 00 00 00 00 00 00 00 00 00 00 00 00 00 00 00
90: 00 00 00 00 00 00 00 00 00 00 00 00 00 00 00 00
a0: 00 00 00 00 00 00 00 00 00 00 00 00 00 00 00 00
b0: 00 00 00 00 00 00 00 00 00 00 00 00 00 00 00 00
c0: 00 0f 00 00 03 00 00 00 00 00 01 00 00 00 00 00
d0: 00 00 00 00 00 00 00 00 00 00 00 00 00 00 00 00
e0: 00 00 00 00 00 00 00 00 00 00 00 00 00 00 00 00
f0: 00 00 00 00 00 00 00 00 86 0f 02 00 00 00 00 00

00:1d.3 USB controller [0c03]: Intel Corporation NM10/ICH7 Family USB UHCI Controller #4 [8086:27cb] (rev 02) (prog-if 00 [UHCI])
	Subsystem: Lenovo ThinkPad T60/R60 series [17aa:200a]
	Control: I/O+ Mem- BusMaster- SpecCycle- MemWINV- VGASnoop- ParErr- Stepping- SERR- FastB2B- DisINTx-
	Status: Cap- 66MHz- UDF- FastB2B+ ParErr- DEVSEL=medium >TAbort- <TAbort- <MAbort- >SERR- <PERR- INTx-
	Interrupt: pin D routed to IRQ 19
	Region 4: I/O ports at 5060 [size=32]
	Kernel driver in use: uhci_hcd
00: 86 80 cb 27 01 00 80 02 02 00 03 0c 00 00 00 00
10: 00 00 00 00 00 00 00 00 00 00 00 00 00 00 00 00
20: 61 50 00 00 00 00 00 00 00 00 00 00 aa 17 0a 20
30: 00 00 00 00 00 00 00 00 00 00 00 00 0b 04 00 00
40: 00 00 00 00 00 00 00 00 00 00 00 00 00 00 00 00
50: 00 00 00 00 00 00 00 00 00 00 00 00 00 00 00 00
60: 10 00 00 00 00 00 00 00 00 00 00 00 00 00 00 00
70: 00 00 00 00 00 00 00 00 00 00 00 00 00 00 00 00
80: 00 00 00 00 00 00 00 00 00 00 00 00 00 00 00 00
90: 00 00 00 00 00 00 00 00 00 00 00 00 00 00 00 00
a0: 00 00 00 00 00 00 00 00 00 00 00 00 00 00 00 00
b0: 00 00 00 00 00 00 00 00 00 00 00 00 00 00 00 00
c0: 00 0f 00 00 03 00 00 00 00 00 01 00 00 00 00 00
d0: 00 00 00 00 00 00 00 00 00 00 00 00 00 00 00 00
e0: 00 00 00 00 00 00 00 00 00 00 00 00 00 00 00 00
f0: 00 00 00 00 00 00 00 00 86 0f 02 00 00 00 00 00

00:1d.7 USB controller [0c03]: Intel Corporation NM10/ICH7 Family USB2 EHCI Controller [8086:27cc] (rev 02) (prog-if 20 [EHCI])
	Subsystem: Lenovo ThinkPad T60/R60 series [17aa:200b]
	Control: I/O- Mem+ BusMaster+ SpecCycle- MemWINV- VGASnoop- ParErr- Stepping- SERR+ FastB2B- DisINTx-
	Status: Cap+ 66MHz- UDF- FastB2B+ ParErr- DEVSEL=medium >TAbort- <TAbort- <MAbort- >SERR- <PERR- INTx-
	Latency: 0
	Interrupt: pin D routed to IRQ 19
	Region 0: Memory at e4344000 (32-bit, non-prefetchable) [size=1K]
	Capabilities: [50] Power Management version 2
		Flags: PMEClk- DSI- D1- D2- AuxCurrent=375mA PME(D0+,D1-,D2-,D3hot+,D3cold+)
		Status: D0 NoSoftRst- PME-Enable- DSel=0 DScale=0 PME-
	Capabilities: [58] Debug port: BAR=1 offset=00a0
	Kernel driver in use: ehci-pci
00: 86 80 cc 27 06 01 90 02 02 20 03 0c 00 00 00 00
10: 00 40 34 e4 00 00 00 00 00 00 00 00 00 00 00 00
20: 00 00 00 00 00 00 00 00 00 00 00 00 aa 17 0b 20
30: 00 00 00 00 50 00 00 00 00 00 00 00 0b 04 00 00
40: 00 00 00 00 00 00 00 00 00 00 00 00 00 00 00 00
50: 01 58 c2 c9 00 00 00 00 0a 00 a0 20 00 00 00 00
60: 20 20 ff 01 00 00 00 00 01 00 00 01 00 00 00 e0
70: 00 00 df 3f 00 00 00 00 00 00 00 00 00 00 00 00
80: 00 00 00 00 11 00 00 00 00 00 00 00 00 00 00 00
90: 00 00 00 00 00 00 00 00 00 00 00 00 00 00 00 00
a0: 00 00 00 00 00 00 00 00 00 00 00 00 00 00 00 00
b0: 00 00 00 00 00 00 00 00 00 00 00 00 00 00 00 00
c0: 00 00 00 00 00 00 00 00 00 00 00 00 00 00 00 00
d0: 00 00 00 00 00 aa ff 00 ff 00 ff 00 20 00 00 88
e0: 00 00 00 00 db b6 6d 00 00 00 00 00 00 00 00 00
f0: 00 80 00 09 88 85 40 00 86 0f 02 00 0a 17 02 20

00:1e.0 PCI bridge [0604]: Intel Corporation 82801 Mobile PCI Bridge [8086:2448] (rev e2) (prog-if 01 [Subtractive decode])
	Control: I/O+ Mem+ BusMaster+ SpecCycle- MemWINV- VGASnoop- ParErr- Stepping- SERR- FastB2B- DisINTx-
	Status: Cap+ 66MHz- UDF- FastB2B- ParErr- DEVSEL=fast >TAbort- <TAbort- <MAbort- >SERR- <PERR- INTx-
	Latency: 0
	Bus: primary=00, secondary=05, subordinate=06, sec-latency=32
	I/O behind bridge: 00002000-00003fff
	Memory behind bridge: e0000000-e20fffff
	Prefetchable memory behind bridge: 00000000e2100000-00000000e40fffff
	Secondary status: 66MHz- FastB2B+ ParErr- DEVSEL=medium >TAbort- <TAbort- <MAbort+ <SERR- <PERR-
	BridgeCtl: Parity- SERR+ NoISA+ VGA- MAbort- >Reset- FastB2B-
		PriDiscTmr- SecDiscTmr- DiscTmrStat- DiscTmrSERREn-
	Capabilities: [50] Subsystem: Device [0000:0000]
00: 86 80 48 24 07 00 10 00 e2 01 04 06 00 00 01 00
10: 00 00 00 00 00 00 00 00 00 05 06 20 20 30 80 22
20: 00 e0 00 e2 11 e2 01 e4 00 00 00 00 00 00 00 00
30: 00 00 00 00 50 00 00 00 00 00 00 00 ff 00 06 00
40: 00 00 00 00 00 00 00 00 00 00 00 00 00 12 00 00
50: 0d 00 00 00 00 00 00 00 00 00 00 00 00 00 00 00
60: 00 00 00 00 00 00 00 00 00 00 00 00 00 00 00 00
70: 00 00 00 00 00 00 00 00 00 00 00 00 00 00 00 00
80: 00 00 00 00 00 00 00 00 00 00 00 00 00 00 00 00
90: 00 00 00 00 00 00 00 00 00 00 00 00 00 00 00 00
a0: 00 00 00 00 00 00 00 00 00 00 00 00 00 00 00 00
b0: 00 00 00 00 00 00 00 00 00 00 00 00 00 00 00 00
c0: 00 00 00 00 00 00 00 00 00 00 00 00 00 00 00 00
d0: 00 00 00 00 00 00 00 00 00 00 00 00 00 00 00 00
e0: 00 00 00 00 00 00 00 00 00 00 00 00 00 00 00 00
f0: 00 00 00 00 00 00 00 00 86 0f 02 00 00 00 00 00

00:1f.0 ISA bridge [0601]: Intel Corporation 82801GBM (ICH7-M) LPC Interface Bridge [8086:27b9] (rev 02)
	Subsystem: Lenovo ThinkPad T60/R60 series [17aa:2009]
	Control: I/O+ Mem+ BusMaster+ SpecCycle- MemWINV- VGASnoop- ParErr- Stepping- SERR- FastB2B- DisINTx-
	Status: Cap+ 66MHz- UDF- FastB2B- ParErr- DEVSEL=medium >TAbort- <TAbort- <MAbort- >SERR- <PERR- INTx-
	Latency: 0
	Capabilities: [e0] Vendor Specific Information: Len=0c <?>
	Kernel driver in use: lpc_ich
00: 86 80 b9 27 07 00 10 02 02 00 01 06 00 00 80 00
10: 00 00 00 00 00 00 00 00 00 00 00 00 00 00 00 00
20: 00 00 00 00 00 00 00 00 00 00 00 00 aa 17 09 20
30: 00 00 00 00 e0 00 00 00 00 00 00 00 00 00 00 00
40: 01 05 00 00 80 00 00 00 81 04 00 00 10 00 00 00
50: 00 00 00 00 00 00 00 00 00 00 00 00 00 00 00 00
60: 80 80 80 80 d0 00 00 00 80 80 80 80 00 00 00 00
70: 00 00 00 00 00 00 00 00 00 00 00 00 00 00 00 00
80: 10 02 0d 1f 01 16 7c 00 e1 15 0c 00 81 16 1c 00
90: 00 00 00 00 00 00 00 00 00 00 00 00 00 00 00 00
a0: ac 06 00 00 30 00 00 00 13 1c 0a 00 00 03 00 00
b0: 00 00 f0 00 00 00 00 00 00 00 02 0a 00 00 00 00
c0: 00 00 00 00 00 00 00 00 00 00 00 00 00 00 00 00
d0: 33 22 11 00 67 45 00 00 cf ff 00 00 08 00 00 00
e0: 09 00 0c 10 b4 02 24 17 00 00 00 00 00 00 00 00
f0: 01 c0 d1 fe 00 00 00 00 86 0f 02 00 00 00 00 00

00:1f.1 IDE interface [0101]: Intel Corporation 82801G (ICH7 Family) IDE Controller [8086:27df] (rev 02) (prog-if 8a [Master SecP PriP])
	Subsystem: Lenovo ThinkPad T60/R60 series [17aa:200c]
	Control: I/O+ Mem- BusMaster+ SpecCycle- MemWINV- VGASnoop- ParErr- Stepping- SERR- FastB2B- DisINTx-
	Status: Cap- 66MHz- UDF- FastB2B+ ParErr- DEVSEL=medium >TAbort- <TAbort- <MAbort- >SERR- <PERR- INTx+
	Latency: 0
	Interrupt: pin C routed to IRQ 16
	Region 0: I/O ports at 01f0 [size=8]
	Region 1: I/O ports at 03f4 [size=1]
	Region 2: I/O ports at 0170 [size=8]
	Region 3: I/O ports at 0374 [size=1]
	Region 4: I/O ports at 5080 [size=16]
	Kernel driver in use: ata_piix
00: 86 80 df 27 05 00 88 02 02 8a 01 01 00 00 00 00
10: a9 50 00 00 c9 50 00 00 b1 50 00 00 cd 50 00 00
20: 81 50 00 00 00 00 00 00 00 00 00 00 aa 17 0c 20
30: 00 00 00 00 00 00 00 00 00 00 00 00 ff 03 00 00
40: 00 40 00 40 00 00 00 00 00 00 00 00 00 00 00 00
50: 00 00 00 00 00 00 00 00 00 00 00 00 00 00 00 00
60: 00 00 00 00 00 00 00 00 00 00 00 00 00 00 00 00
70: 00 00 00 00 00 00 00 00 00 00 00 00 00 00 00 00
80: 00 00 00 00 00 00 00 00 00 00 00 00 00 00 00 00
90: 00 00 00 00 00 00 00 00 00 00 00 00 00 00 00 00
a0: 00 00 00 00 00 00 00 00 00 00 00 00 00 00 00 00
b0: 00 00 00 00 00 00 00 00 00 00 00 00 00 00 00 00
c0: 00 00 00 00 00 00 00 00 00 00 00 00 00 00 00 00
d0: 00 00 00 00 00 00 00 00 00 00 00 00 00 00 00 00
e0: 00 00 00 00 00 00 00 00 00 00 00 00 00 00 00 00
f0: 00 00 00 00 00 00 00 00 86 0f 02 00 00 00 00 00

00:1f.2 SATA controller [0106]: Intel Corporation 82801GBM/GHM (ICH7-M Family) SATA Controller [AHCI mode] [8086:27c5] (rev 02) (prog-if 01 [AHCI 1.0])
	Subsystem: Lenovo ThinkPad T60/R60 series [17aa:200d]
	Control: I/O+ Mem+ BusMaster+ SpecCycle- MemWINV- VGASnoop- ParErr- Stepping- SERR- FastB2B- DisINTx+
	Status: Cap+ 66MHz+ UDF- FastB2B+ ParErr- DEVSEL=medium >TAbort- <TAbort- <MAbort- >SERR- <PERR- INTx-
	Latency: 0
	Interrupt: pin B routed to IRQ 45
	Region 0: I/O ports at 50b8 [size=8]
	Region 1: I/O ports at 50d0 [size=4]
	Region 2: I/O ports at 50c0 [size=8]
	Region 3: I/O ports at 50d4 [size=4]
	Region 4: I/O ports at 5090 [size=16]
	Region 5: Memory at e4344400 (32-bit, non-prefetchable) [size=1K]
	Capabilities: [80] MSI: Enable+ Count=1/1 Maskable- 64bit-
		Address: fee0300c  Data: 4152
	Capabilities: [70] Power Management version 2
		Flags: PMEClk- DSI- D1- D2- AuxCurrent=0mA PME(D0-,D1-,D2-,D3hot+,D3cold-)
		Status: D0 NoSoftRst- PME-Enable- DSel=0 DScale=0 PME-
	Kernel driver in use: ahci
00: 86 80 c5 27 07 04 b0 02 02 01 06 01 00 00 00 00
10: b9 50 00 00 d1 50 00 00 c1 50 00 00 d5 50 00 00
20: 91 50 00 00 00 44 34 e4 00 00 00 00 aa 17 0d 20
30: 00 00 00 00 80 00 00 00 00 00 00 00 00 02 00 00
40: 07 a3 00 80 00 00 00 00 01 00 01 00 00 00 00 00
50: 00 00 00 00 03 30 00 00 00 00 00 00 00 00 00 00
60: 00 00 00 00 00 00 00 00 00 00 00 00 00 00 00 00
70: 01 00 02 40 00 00 00 00 00 00 00 00 00 00 00 00
80: 05 70 01 00 0c 30 e0 fe 52 41 00 00 00 00 00 00
90: 40 00 15 02 80 01 00 5a 00 00 00 00 00 00 00 00
a0: 00 00 00 00 00 00 00 00 00 00 00 00 00 00 00 00
b0: 00 00 00 00 00 00 00 00 00 00 00 00 00 00 00 00
c0: 00 00 00 00 00 00 00 00 00 00 00 00 00 00 00 00
d0: 00 00 00 00 00 00 00 00 00 00 00 00 00 00 00 00
e0: 00 00 00 00 00 00 00 00 00 00 00 00 00 00 00 00
f0: 00 00 00 00 00 00 00 00 86 0f 02 00 00 00 00 00

00:1f.3 SMBus [0c05]: Intel Corporation NM10/ICH7 Family SMBus Controller [8086:27da] (rev 02)
	Subsystem: Lenovo ThinkPad T60/R60 series [17aa:200f]
	Control: I/O+ Mem- BusMaster- SpecCycle- MemWINV- VGASnoop- ParErr- Stepping- SERR+ FastB2B- DisINTx-
	Status: Cap- 66MHz- UDF- FastB2B+ ParErr- DEVSEL=medium >TAbort- <TAbort- <MAbort- >SERR- <PERR- INTx-
	Interrupt: pin A routed to IRQ 11
	Region 4: I/O ports at 0400 [size=32]
00: 86 80 da 27 01 01 80 02 02 00 05 0c 00 00 00 00
10: 00 00 00 00 00 00 00 00 00 00 00 00 00 00 00 00
20: 01 04 00 00 00 00 00 00 00 00 00 00 aa 17 0f 20
30: 00 00 00 00 00 00 00 00 00 00 00 00 0b 01 00 00
40: 01 00 00 00 00 00 00 00 00 00 00 00 00 00 00 00
50: 00 00 00 00 00 00 00 00 00 00 00 00 00 00 00 00
60: 00 00 00 00 00 00 00 00 00 00 00 00 00 00 00 00
70: 00 00 00 00 00 00 00 00 00 00 00 00 00 00 00 00
80: 00 00 00 00 00 00 00 00 00 00 00 00 00 00 00 00
90: 00 00 00 00 00 00 00 00 00 00 00 00 00 00 00 00
a0: 00 00 00 00 00 00 00 00 00 00 00 00 00 00 00 00
b0: 00 00 00 00 00 00 00 00 00 00 00 00 00 00 00 00
c0: 00 00 00 00 00 00 00 00 00 00 00 00 00 00 00 00
d0: 00 00 00 00 00 00 00 00 00 00 00 00 00 00 00 00
e0: 00 00 00 00 00 00 00 00 00 00 00 00 00 00 00 00
f0: 00 00 00 00 00 00 00 00 86 0f 02 00 00 00 00 00

01:00.0 Ethernet controller [0200]: Intel Corporation 82573L Gigabit Ethernet Controller [8086:109a]
	Subsystem: Lenovo ThinkPad X60s [17aa:207e]
	Physical Slot: 0
	Control: I/O- Mem- BusMaster- SpecCycle- MemWINV- VGASnoop- ParErr- Stepping- SERR- FastB2B- DisINTx+
	Status: Cap+ 66MHz- UDF- FastB2B- ParErr- DEVSEL=fast >TAbort- <TAbort- <MAbort- >SERR- <PERR- INTx-
	Interrupt: pin A routed to IRQ 44
	Region 0: Memory at e4100000 (32-bit, non-prefetchable) [disabled] [size=128K]
	Region 2: I/O ports at 4000 [disabled] [size=32]
	Capabilities: [c8] Power Management version 2
		Flags: PMEClk- DSI+ D1- D2- AuxCurrent=0mA PME(D0+,D1-,D2-,D3hot+,D3cold+)
		Status: D3 NoSoftRst- PME-Enable+ DSel=0 DScale=1 PME-
	Capabilities: [d0] MSI: Enable+ Count=1/1 Maskable- 64bit+
		Address: 00000000fee0300c  Data: 4182
	Capabilities: [e0] Express (v1) Endpoint, MSI 00
		DevCap:	MaxPayload 256 bytes, PhantFunc 0, Latency L0s <512ns, L1 <64us
			ExtTag- AttnBtn- AttnInd- PwrInd- RBE- FLReset-
		DevCtl:	Report errors: Correctable+ Non-Fatal+ Fatal+ Unsupported+
			RlxdOrd+ ExtTag- PhantFunc- AuxPwr- NoSnoop+
			MaxPayload 128 bytes, MaxReadReq 512 bytes
		DevSta:	CorrErr- UncorrErr- FatalErr- UnsuppReq- AuxPwr+ TransPend-
		LnkCap:	Port #0, Speed 2.5GT/s, Width x1, ASPM L0s L1, Latency L0 <128ns, L1 <64us
			ClockPM+ Surprise- LLActRep- BwNot-
		LnkCtl:	ASPM Disabled; RCB 64 bytes Disabled- Retrain- CommClk-
			ExtSynch- ClockPM- AutWidDis- BWInt- AutBWInt-
		LnkSta:	Speed 2.5GT/s, Width x1, TrErr- Train- SlotClk+ DLActive- BWMgmt- ABWMgmt-
	Capabilities: [100 v1] Advanced Error Reporting
		UESta:	DLP- SDES- TLP- FCP- CmpltTO- CmpltAbrt- UnxCmplt- RxOF- MalfTLP- ECRC- UnsupReq- ACSViol-
		UEMsk:	DLP- SDES- TLP- FCP- CmpltTO- CmpltAbrt- UnxCmplt- RxOF- MalfTLP- ECRC- UnsupReq- ACSViol-
		UESvrt:	DLP+ SDES- TLP- FCP+ CmpltTO- CmpltAbrt- UnxCmplt- RxOF+ MalfTLP+ ECRC- UnsupReq- ACSViol-
		CESta:	RxErr- BadTLP- BadDLLP- Rollover- Timeout- NonFatalErr-
		CEMsk:	RxErr- BadTLP- BadDLLP- Rollover- Timeout- NonFatalErr-
		AERCap:	First Error Pointer: 00, GenCap- CGenEn- ChkCap- ChkEn-
	Capabilities: [140 v1] Device Serial Number 00-16-d3-ff-ff-b6-d0-98
	Kernel driver in use: e1000e
00: 86 80 9a 10 00 04 10 00 00 00 00 02 10 00 00 00
10: 00 00 10 e4 00 00 00 00 01 40 00 00 00 00 00 00
20: 00 00 00 00 00 00 00 00 00 00 00 00 aa 17 7e 20
30: 00 00 00 00 c8 00 00 00 00 00 00 00 0b 01 00 00
40: 00 00 00 00 00 00 00 00 00 00 00 00 00 00 00 00
50: 00 00 00 00 00 00 00 00 00 00 00 00 00 00 00 00
60: 00 00 00 00 00 00 00 00 00 00 00 00 00 00 00 00
70: 00 00 00 00 00 00 00 00 00 00 00 00 00 00 00 00
80: 00 00 00 00 00 00 00 00 00 00 00 00 00 00 00 00
90: 00 00 00 00 00 00 00 00 00 00 00 00 00 00 00 00
a0: 00 00 00 00 00 00 00 00 00 00 00 00 00 00 00 00
b0: 00 00 00 00 00 00 00 00 00 00 00 00 00 00 00 00
c0: 00 00 00 00 00 00 00 00 01 d0 22 c8 03 21 00 0f
d0: 05 e0 81 00 0c 30 e0 fe 00 00 00 00 82 41 00 00
e0: 10 00 01 00 c1 0c 00 00 1f 28 10 00 11 1c 07 00
f0: 00 00 11 10 00 00 00 00 00 00 00 00 00 00 00 00

05:00.0 CardBus bridge [0607]: Ricoh Co Ltd RL5c476 II [1180:0476] (rev b4)
	Control: I/O+ Mem+ BusMaster+ SpecCycle- MemWINV- VGASnoop- ParErr- Stepping- SERR- FastB2B- DisINTx-
	Status: Cap+ 66MHz- UDF- FastB2B- ParErr- DEVSEL=medium >TAbort- <TAbort- <MAbort- >SERR- <PERR- INTx-
	Latency: 168
	Interrupt: pin A routed to IRQ 16
	Region 0: Memory at e2000000 (32-bit, non-prefetchable) [size=4K]
	Bus: primary=05, secondary=06, subordinate=06, sec-latency=176
	Memory window 0: 84000000-87fff000 (prefetchable)
	Memory window 1: 88000000-8bfff000
	I/O window 0: 00002000-000020ff
	I/O window 1: 00002400-000024ff
	BridgeCtl: Parity+ SERR+ ISA- VGA- MAbort- >Reset- 16bInt+ PostWrite+
	16-bit legacy interface ports at 0001
	Kernel driver in use: yenta_cardbus
00: 80 11 76 04 07 00 10 02 b4 00 07 06 00 a8 82 00
10: 00 00 00 e2 dc 00 00 02 05 06 06 b0 00 00 00 84
20: 00 f0 ff 87 00 00 00 88 00 f0 ff 8b 00 20 00 00
30: fc 20 00 00 00 24 00 00 fc 24 00 00 0b 01 83 05
40: 00 00 00 00 01 00 00 00 00 00 00 00 00 00 00 00
50: 00 00 00 00 00 00 00 00 00 00 00 00 00 00 00 00
60: 00 00 00 00 00 00 00 00 00 00 00 00 00 00 00 00
70: 00 00 00 00 00 00 00 00 00 00 00 00 00 00 00 00
80: 01 00 a0 00 00 03 00 00 63 04 63 04 00 00 00 00
90: 00 00 00 00 00 00 00 00 00 00 00 00 00 00 00 00
a0: 08 00 00 00 00 00 00 00 00 00 00 00 00 00 00 00
b0: 00 00 00 00 00 00 00 b2 00 30 00 00 00 00 00 00
c0: 00 00 00 00 00 00 00 00 00 00 00 00 00 00 00 00
d0: 00 00 00 00 00 00 00 00 00 00 00 00 01 00 0a fe
e0: 00 40 c0 24 00 00 00 00 00 00 00 00 00 00 00 00
f0: 00 00 00 00 00 00 00 00 00 00 00 00 00 00 00 00

05:00.1 FireWire (IEEE 1394) [0c00]: Ricoh Co Ltd R5C552 IEEE 1394 Controller [1180:0552] (rev 09) (prog-if 10 [OHCI])
	Control: I/O- Mem+ BusMaster+ SpecCycle- MemWINV- VGASnoop- ParErr- Stepping- SERR- FastB2B- DisINTx-
	Status: Cap+ 66MHz- UDF- FastB2B- ParErr- DEVSEL=medium >TAbort- <TAbort- <MAbort- >SERR- <PERR- INTx-
	Latency: 64 (500ns min, 1000ns max)
	Interrupt: pin B routed to IRQ 17
	Region 0: Memory at e2001000 (32-bit, non-prefetchable) [size=2K]
	Capabilities: [dc] Power Management version 2
		Flags: PMEClk- DSI- D1+ D2+ AuxCurrent=0mA PME(D0+,D1+,D2+,D3hot+,D3cold+)
		Status: D0 NoSoftRst- PME-Enable- DSel=0 DScale=2 PME+
	Kernel driver in use: firewire_ohci
00: 80 11 52 05 06 00 10 02 09 10 00 0c 00 40 80 00
10: 00 10 00 e2 00 00 00 00 00 00 00 00 00 00 00 00
20: 00 00 00 00 00 00 00 00 00 00 00 00 00 00 00 00
30: 00 00 00 00 dc 00 00 00 00 00 00 00 0b 02 02 04
40: 00 00 00 00 00 00 00 00 00 00 00 00 00 00 00 00
50: 00 00 00 00 00 00 00 00 00 00 00 00 00 00 00 00
60: 00 00 00 00 00 00 00 00 00 00 00 00 00 00 00 00
70: 00 00 00 00 00 00 00 00 00 00 00 00 00 00 00 00
80: 00 00 80 16 00 00 00 00 00 20 00 00 66 66 32 12
90: 48 60 66 10 00 00 02 00 00 80 00 00 00 01 18 00
a0: 00 00 00 00 00 00 00 00 20 00 00 00 00 00 00 00
b0: 00 00 00 00 00 00 00 00 00 00 00 00 00 00 02 04
c0: 00 00 00 00 00 00 00 00 00 00 00 00 00 00 00 00
d0: 00 00 00 00 00 00 00 00 00 00 00 00 01 00 02 fe
e0: 00 c0 00 48 00 00 00 00 00 00 00 00 00 00 00 00
f0: 00 00 00 00 00 00 00 00 00 00 00 00 00 00 00 00

05:00.2 SD Host controller [0805]: Ricoh Co Ltd R5C822 SD/SDIO/MMC/MS/MSPro Host Adapter [1180:0822] (rev 18)
	Control: I/O- Mem+ BusMaster+ SpecCycle- MemWINV- VGASnoop- ParErr- Stepping- SERR- FastB2B- DisINTx-
	Status: Cap+ 66MHz- UDF- FastB2B- ParErr- DEVSEL=medium >TAbort- <TAbort- <MAbort- >SERR- <PERR- INTx-
	Latency: 64
	Interrupt: pin C routed to IRQ 18
	Region 0: Memory at e2001800 (32-bit, non-prefetchable) [size=256]
	Capabilities: [80] Power Management version 2
		Flags: PMEClk- DSI- D1+ D2+ AuxCurrent=0mA PME(D0+,D1+,D2+,D3hot+,D3cold+)
		Status: D0 NoSoftRst- PME-Enable- DSel=0 DScale=2 PME-
	Kernel driver in use: sdhci-pci
00: 80 11 22 08 06 00 10 02 18 00 05 08 00 40 80 00
10: 00 18 00 e2 00 00 00 00 00 00 00 00 00 00 00 00
20: 00 00 00 00 00 00 00 00 00 00 00 00 00 00 00 00
30: 00 00 00 00 80 00 00 00 00 00 00 00 0b 03 00 00
40: 00 00 00 00 00 00 00 00 00 00 00 00 00 00 00 00
50: 00 00 00 00 00 00 00 00 00 00 00 00 00 00 00 00
60: 00 00 00 00 00 00 00 00 00 00 00 00 00 00 00 00
70: 00 00 00 00 00 00 00 00 00 00 00 00 00 00 00 00
80: 01 00 02 fe 00 40 00 48 00 00 00 00 00 00 00 00
90: 00 00 00 00 00 00 00 00 00 00 00 00 00 00 00 00
a0: 00 00 00 00 00 00 00 00 00 00 00 00 00 00 00 00
b0: 00 00 02 00 00 00 00 00 00 00 00 00 a0 00 00 00
c0: 00 00 00 00 00 00 00 00 00 00 00 00 00 00 00 00
d0: 00 00 00 00 00 00 00 00 00 00 00 00 00 00 00 00
e0: a1 21 80 01 00 00 00 00 40 00 00 00 00 00 00 00
f0: 00 00 00 00 00 00 00 00 c3 00 20 02 00 00 00 00

